{
  "schema_version": "s12-engine-identity-profile-0.4",
  "profile_id": "hellcat_2022_stock",
  "synthetic": true,
  "engine_type": {"value":"supercharged_cross_plane_v8","unit":"enum","range":["supercharged_cross_plane_v8","naturally_aspirated_flat_plane_v8"],"source_level":"C","source":"synthetic","source_url":"","source_scope":"Synthetic Hellcat-style identity; not OEM calibration.","verification_state":"synthetic_assumption"},
  "cylinder_count": {"value":8,"unit":"count","range":[1,12],"source_level":"C","source":"synthetic","source_url":"","source_scope":"Synthetic engine identity topology; not OEM calibration.","verification_state":"synthetic_assumption"},
  "combustion_type": {"value":"cross_plane_piston","unit":"enum","range":["cross_plane_piston","flat_plane_piston"],"source_level":"C","source":"synthetic","source_url":"","source_scope":"Synthetic combustion identity; not OEM calibration.","verification_state":"synthetic_assumption"},
  "rpm_limit": {"value":6500,"unit":"rpm","range":[1000,12000],"source_level":"C","source":"synthetic","source_url":"","source_scope":"Synthetic identity RPM limit; not OEM calibration.","verification_state":"synthetic_assumption"},
  "firing_character": {"pulse_shape":{"value":"cross_plane_uneven_bank_pulse","unit":"enum","range":["cross_plane_uneven_bank_pulse","flat_plane_sharp_pulse"],"source_level":"C","source":"synthetic","source_url":"","source_scope":"Synthetic firing character; not OEM calibration.","verification_state":"synthetic_assumption"},"pulse_width":{"value":0.26,"unit":"ratio","range":[0,1],"source_level":"C","source":"synthetic","source_url":"","source_scope":"Synthetic firing character; not OEM calibration.","verification_state":"synthetic_assumption"},"bank_asymmetry":{"value":0.22,"unit":"ratio","range":[0,1],"source_level":"C","source":"synthetic","source_url":"","source_scope":"Synthetic firing character; not OEM calibration.","verification_state":"synthetic_assumption"}},
  "order_profile": {"primary_order":{"value":2,"unit":"order","range":[0.5,64],"source_level":"C","source":"synthetic","source_url":"","source_scope":"Synthetic order identity; not OEM calibration.","verification_state":"synthetic_assumption"},"secondary_order":{"value":4,"unit":"order","range":[0.5,64],"source_level":"C","source":"synthetic","source_url":"","source_scope":"Synthetic order identity; not OEM calibration.","verification_state":"synthetic_assumption"},"high_order":{"value":8,"unit":"order","range":[0.5,64],"source_level":"C","source":"synthetic","source_url":"","source_scope":"Synthetic order identity; not OEM calibration.","verification_state":"synthetic_assumption"}},
  "harmonic_profile": {"base_gain":{"value":0.12,"unit":"ratio","range":[0,1],"source_level":"C","source":"synthetic","source_url":"","source_scope":"Synthetic harmonic identity; not OEM calibration.","verification_state":"synthetic_assumption"},"high_rpm_gain":{"value":0.18,"unit":"ratio","range":[0,1],"source_level":"C","source":"synthetic","source_url":"","source_scope":"Synthetic harmonic identity; not OEM calibration.","verification_state":"synthetic_assumption"},"rpm_exponent":{"value":1.1,"unit":"ratio","range":[0.1,4],"source_level":"C","source":"synthetic","source_url":"","source_scope":"Synthetic harmonic identity; not OEM calibration.","verification_state":"synthetic_assumption"},"high_frequency_order":{"value":10,"unit":"order","range":[0.5,80],"source_level":"C","source":"synthetic","source_url":"","source_scope":"Synthetic harmonic identity; not OEM calibration.","verification_state":"synthetic_assumption"}},
  "transient_profile": {"attack_gain":{"value":0.18,"unit":"ratio","range":[0,1],"source_level":"C","source":"synthetic","source_url":"","source_scope":"Synthetic transient identity; not OEM calibration.","verification_state":"synthetic_assumption"},"release_per_frame":{"value":0.08,"unit":"ratio","range":[0,1],"source_level":"C","source":"synthetic","source_url":"","source_scope":"Synthetic transient identity; not OEM calibration.","verification_state":"synthetic_assumption"},"load_coupling":{"value":0.60,"unit":"ratio","range":[0,1],"source_level":"C","source":"synthetic","source_url":"","source_scope":"Synthetic transient identity; not OEM calibration.","verification_state":"synthetic_assumption"}},
  "mechanical_noise_profile": {"base_gain":{"value":0.18,"unit":"ratio","range":[0,1],"source_level":"C","source":"synthetic","source_url":"","source_scope":"Synthetic mechanical identity; not OEM calibration.","verification_state":"synthetic_assumption"},"mechanical_order":{"value":5,"unit":"order","range":[0.5,64],"source_level":"C","source":"synthetic","source_url":"","source_scope":"Synthetic mechanical identity; not OEM calibration.","verification_state":"synthetic_assumption"},"roughness":{"value":0.20,"unit":"ratio","range":[0,1],"source_level":"C","source":"synthetic","source_url":"","source_scope":"Synthetic mechanical identity; not OEM calibration.","verification_state":"synthetic_assumption"}},
  "turbo_or_supercharger_profile": {"architecture":{"value":"supercharger","unit":"enum","range":["none","supercharger","twin_turbo"],"source_level":"C","source":"synthetic","source_url":"","source_scope":"Synthetic supercharger identity; not OEM calibration.","verification_state":"synthetic_assumption"},"drive_ratio":{"value":2.2,"unit":"ratio","range":[0,8],"source_level":"C","source":"synthetic","source_url":"","source_scope":"Synthetic supercharger identity; not OEM calibration.","verification_state":"synthetic_assumption"},"whine_gain":{"value":0.45,"unit":"ratio","range":[0,1],"source_level":"C","source":"synthetic","source_url":"","source_scope":"Synthetic supercharger identity; not OEM calibration.","verification_state":"synthetic_assumption"},"spool_rate":{"value":0.20,"unit":"ratio","range":[0,1],"source_level":"C","source":"synthetic","source_url":"","source_scope":"Synthetic supercharger identity; not OEM calibration.","verification_state":"synthetic_assumption"},"turbine_gain":{"value":0.06,"unit":"ratio","range":[0,1],"source_level":"C","source":"synthetic","source_url":"","source_scope":"Synthetic supercharger identity; not OEM calibration.","verification_state":"synthetic_assumption"}},
  "acoustic_color_profile": {"low_band_gain":{"value":0.55,"unit":"ratio","range":[0,1],"source_level":"C","source":"synthetic","source_url":"","source_scope":"Synthetic acoustic color; not OEM calibration.","verification_state":"synthetic_assumption"},"mid_band_gain":{"value":0.20,"unit":"ratio","range":[0,1],"source_level":"C","source":"synthetic","source_url":"","source_scope":"Synthetic acoustic color; not OEM calibration.","verification_state":"synthetic_assumption"},"high_band_gain":{"value":0.10,"unit":"ratio","range":[0,1],"source_level":"C","source":"synthetic","source_url":"","source_scope":"Synthetic acoustic color; not OEM calibration.","verification_state":"synthetic_assumption"}}
}
