{
  "schema_version": "s12-engine-identity-profile-0.4",
  "profile_id": "rx7_fd_1991_stock",
  "synthetic": true,
  "engine_type": {"value":"twin_rotor_turbo","unit":"enum","range":["twin_rotor_turbo","supercharged_cross_plane_v8"],"source_level":"C","source":"synthetic","source_url":"","source_scope":"Synthetic RX-7-style identity; not OEM calibration.","verification_state":"synthetic_assumption"},
  "cylinder_count": {"value":2,"unit":"rotor_count","range":[1,12],"source_level":"C","source":"synthetic","source_url":"","source_scope":"Synthetic engine identity topology; not OEM calibration.","verification_state":"synthetic_assumption"},
  "combustion_type": {"value":"rotary_three_chamber","unit":"enum","range":["rotary_three_chamber","cross_plane_piston"],"source_level":"C","source":"synthetic","source_url":"","source_scope":"Synthetic rotary combustion identity; not OEM calibration.","verification_state":"synthetic_assumption"},
  "rpm_limit": {"value":8000,"unit":"rpm","range":[1000,12000],"source_level":"C","source":"synthetic","source_url":"","source_scope":"Synthetic identity RPM limit; not OEM calibration.","verification_state":"synthetic_assumption"},
  "firing_character": {"pulse_shape":{"value":"rotary_chamber_pulse_train","unit":"enum","range":["rotary_chamber_pulse_train","flat_plane_sharp_pulse"],"source_level":"C","source":"synthetic","source_url":"","source_scope":"Synthetic rotary firing character; not OEM calibration.","verification_state":"synthetic_assumption"},"pulse_width":{"value":0.38,"unit":"ratio","range":[0,1],"source_level":"C","source":"synthetic","source_url":"","source_scope":"Synthetic rotary firing character; not OEM calibration.","verification_state":"synthetic_assumption"},"bank_asymmetry":{"value":0.10,"unit":"ratio","range":[0,1],"source_level":"C","source":"synthetic","source_url":"","source_scope":"Synthetic rotary firing character; not OEM calibration.","verification_state":"synthetic_assumption"}},
  "order_profile": {"primary_order":{"value":1,"unit":"order","range":[0.5,64],"source_level":"C","source":"synthetic","source_url":"","source_scope":"Synthetic rotary order identity; not OEM calibration.","verification_state":"synthetic_assumption"},"secondary_order":{"value":3,"unit":"order","range":[0.5,64],"source_level":"C","source":"synthetic","source_url":"","source_scope":"Synthetic rotary order identity; not OEM calibration.","verification_state":"synthetic_assumption"},"high_order":{"value":6,"unit":"order","range":[0.5,64],"source_level":"C","source":"synthetic","source_url":"","source_scope":"Synthetic rotary order identity; not OEM calibration.","verification_state":"synthetic_assumption"}},
  "harmonic_profile": {"base_gain":{"value":0.16,"unit":"ratio","range":[0,1],"source_level":"C","source":"synthetic","source_url":"","source_scope":"Synthetic rotary harmonic identity; not OEM calibration.","verification_state":"synthetic_assumption"},"high_rpm_gain":{"value":0.30,"unit":"ratio","range":[0,1],"source_level":"C","source":"synthetic","source_url":"","source_scope":"Synthetic rotary harmonic identity; not OEM calibration.","verification_state":"synthetic_assumption"},"rpm_exponent":{"value":1.2,"unit":"ratio","range":[0.1,4],"source_level":"C","source":"synthetic","source_url":"","source_scope":"Synthetic rotary harmonic identity; not OEM calibration.","verification_state":"synthetic_assumption"},"high_frequency_order":{"value":18,"unit":"order","range":[0.5,80],"source_level":"C","source":"synthetic","source_url":"","source_scope":"Synthetic rotary harmonic identity; not OEM calibration.","verification_state":"synthetic_assumption"}},
  "transient_profile": {"attack_gain":{"value":0.12,"unit":"ratio","range":[0,1],"source_level":"C","source":"synthetic","source_url":"","source_scope":"Synthetic rotary transient identity; not OEM calibration.","verification_state":"synthetic_assumption"},"release_per_frame":{"value":0.10,"unit":"ratio","range":[0,1],"source_level":"C","source":"synthetic","source_url":"","source_scope":"Synthetic rotary transient identity; not OEM calibration.","verification_state":"synthetic_assumption"},"load_coupling":{"value":0.65,"unit":"ratio","range":[0,1],"source_level":"C","source":"synthetic","source_url":"","source_scope":"Synthetic rotary transient identity; not OEM calibration.","verification_state":"synthetic_assumption"}},
  "mechanical_noise_profile": {"base_gain":{"value":0.14,"unit":"ratio","range":[0,1],"source_level":"C","source":"synthetic","source_url":"","source_scope":"Synthetic rotary mechanical identity; not OEM calibration.","verification_state":"synthetic_assumption"},"mechanical_order":{"value":3,"unit":"order","range":[0.5,64],"source_level":"C","source":"synthetic","source_url":"","source_scope":"Synthetic rotary mechanical identity; not OEM calibration.","verification_state":"synthetic_assumption"},"roughness":{"value":0.55,"unit":"ratio","range":[0,1],"source_level":"C","source":"synthetic","source_url":"","source_scope":"Synthetic rotary mechanical identity; not OEM calibration.","verification_state":"synthetic_assumption"}},
  "turbo_or_supercharger_profile": {"architecture":{"value":"twin_turbo","unit":"enum","range":["none","supercharger","twin_turbo"],"source_level":"C","source":"synthetic","source_url":"","source_scope":"Synthetic turbo identity; not OEM calibration.","verification_state":"synthetic_assumption"},"drive_ratio":{"value":4.8,"unit":"ratio","range":[0,8],"source_level":"C","source":"synthetic","source_url":"","source_scope":"Synthetic turbo identity; not OEM calibration.","verification_state":"synthetic_assumption"},"whine_gain":{"value":0.20,"unit":"ratio","range":[0,1],"source_level":"C","source":"synthetic","source_url":"","source_scope":"Synthetic turbo identity; not OEM calibration.","verification_state":"synthetic_assumption"},"spool_rate":{"value":0.25,"unit":"ratio","range":[0,1],"source_level":"C","source":"synthetic","source_url":"","source_scope":"Synthetic turbo identity; not OEM calibration.","verification_state":"synthetic_assumption"},"turbine_gain":{"value":0.28,"unit":"ratio","range":[0,1],"source_level":"C","source":"synthetic","source_url":"","source_scope":"Synthetic turbo identity; not OEM calibration.","verification_state":"synthetic_assumption"}},
  "acoustic_color_profile": {"low_band_gain":{"value":0.18,"unit":"ratio","range":[0,1],"source_level":"C","source":"synthetic","source_url":"","source_scope":"Synthetic rotary acoustic color; not OEM calibration.","verification_state":"synthetic_assumption"},"mid_band_gain":{"value":0.32,"unit":"ratio","range":[0,1],"source_level":"C","source":"synthetic","source_url":"","source_scope":"Synthetic rotary acoustic color; not OEM calibration.","verification_state":"synthetic_assumption"},"high_band_gain":{"value":0.38,"unit":"ratio","range":[0,1],"source_level":"C","source":"synthetic","source_url":"","source_scope":"Synthetic rotary acoustic color; not OEM calibration.","verification_state":"synthetic_assumption"}}
}
